{
  "schemaVersion": 4,
  "tripId": "city-demo",
  "profileStandardVersion": "v1",
  "regions": {
    "city": {
      "name": "市中心",
      "label": "城市",
      "type": "city",
      "lat": 35.6812,
      "lon": 139.7671,
      "scoreNote": "雨天帶遮",
      "activityProfiles": [
        {
          "id": "city_walk",
          "weight": 0.5
        },
        {
          "id": "indoor",
          "weight": 0.5
        }
      ]
    }
  },
  "dayRegions": {
    "d1": "city"
  },
  "scoreProfiles": {
    "city": {
      "visibility": 0.15,
      "cloud": 0.05,
      "gust": 0.25,
      "precipitation": 0.4,
      "snow": 0.15
    }
  }
}
