{
  "schemaVersion": 4,
  "tripId": "hokkaido-2025",
  "regions": {
    "hakodate": {
      "name": "函館",
      "lat": 41.7687,
      "lon": 140.7288,
      "timezone": "Asia/Tokyo",
      "label": "函館",
      "type": "cityscenic",
      "activityProfiles": [
        "city_walk",
        "sakura_viewing",
        "night_view"
      ]
    },
    "toyako": {
      "name": "洞爺湖",
      "lat": 42.603,
      "lon": 140.852,
      "timezone": "Asia/Tokyo",
      "label": "洞爺湖",
      "type": "scenic",
      "activityProfiles": [
        "scenic",
        "onsen",
        "drive"
      ]
    },
    "noboribetsu": {
      "name": "登別",
      "lat": 42.492,
      "lon": 141.143,
      "timezone": "Asia/Tokyo",
      "label": "登別",
      "type": "volcanic",
      "activityProfiles": [
        "volcanic_walk",
        "onsen",
        "drive"
      ]
    },
    "sapporo": {
      "name": "札幌",
      "lat": 43.0618,
      "lon": 141.3545,
      "timezone": "Asia/Tokyo",
      "label": "札幌",
      "type": "cityscenic",
      "activityProfiles": [
        "city_walk",
        "sakura_viewing",
        "drive",
        "night_view"
      ]
    },
    "otaru": {
      "name": "小樽",
      "lat": 43.1907,
      "lon": 140.9947,
      "timezone": "Asia/Tokyo",
      "label": "小樽",
      "type": "cityscenic",
      "activityProfiles": [
        "city_walk",
        "sakura_viewing",
        "drive",
        "night_view"
      ]
    }
  },
  "profileStandardVersion": "v1",
  "dayRegions": {
    "d1": "hakodate",
    "d2": "hakodate",
    "d3": "toyako",
    "d4": "noboribetsu",
    "d5": "sapporo",
    "d6": "sapporo",
    "d7": "otaru",
    "d8": "sapporo"
  },
  "scoreProfiles": {}
}
